{
  "version": 4,
  "metric": "masked-ssim-luma-v2",
  "pass": 0.9,
  "minor": 0.8,
  "major": 0.65,
  "aspectTolerance": 0.15,
  "minCoverage": 0.005,
  "bgTolerance": 24,
  "deltaEPass": 3,
  "shiftRadius": 2,
  "gaussianSigma": 1.5,
  "aaTolerance": 1,
  "varFloor": 12,
  "deltaEStride": 2,
  "zoneGate": true,
  "zoneBlocker": 0.35,
  "zoneTextBlocker": 0.25,
  "minRegionPx": 400,
  "statusBarDp": 24,
  "navBarDp": 48,
  "extraContentWarn": 0.02,
  "extraContentDeltaE": 10,
  "extraContentRingPx": 3
}
